drop table if exists cache_point;
create table cache_point (id int primary key auto_increment, u int unique, v int);
insert into cache_point values(1, 11, 101);
insert into cache_point values(2, 12, 102);
alter table cache_point cache;
select * from cache_point where id=1;
id	u	v
1	11	101
select * from cache_point where u=11;
id	u	v
1	11	101
select * from cache_point where id=2;
id	u	v
2	12	102
select * from cache_point where u=12;
id	u	v
2	12	102
select * from cache_point where u > 10 and u < 12;
id	u	v
1	11	101
begin;
select * from cache_point where id=1;
id	u	v
1	11	101
select * from cache_point where u=11;
id	u	v
1	11	101
select * from cache_point where id=2;
id	u	v
2	12	102
select * from cache_point where u=12;
id	u	v
2	12	102
insert into cache_point values(3, 13, 103);
select * from cache_point where id=3;
id	u	v
3	13	103
select * from cache_point where u=13;
id	u	v
3	13	103
select * from cache_point where u > 12 and u < 14;
id	u	v
3	13	103
update cache_point set v=999 where id=2;
select * from cache_point where id=2;
id	u	v
2	12	999
commit;
select * from cache_point where id=3;
id	u	v
3	13	103
select * from cache_point where u=13;
id	u	v
3	13	103
select * from cache_point where id=2;
id	u	v
2	12	102
alter table cache_point nocache;
drop table cache_point;
drop table if exists bp_cache_tmp1;
create  table bp_cache_tmp1 (id int primary key auto_increment, u int unique, v int);
insert into bp_cache_tmp1 values(1, 11, 101);
insert into bp_cache_tmp1 values(2, 12, 102);
insert into bp_cache_tmp1 values(3, 13, 103);
insert into bp_cache_tmp1 values(4, 14, 104);
alter table bp_cache_tmp1 cache;
select * from bp_cache_tmp1 where id in (1, 3);
id	u	v
1	11	101
3	13	103
select * from bp_cache_tmp1 where u in (11, 13);
id	u	v
1	11	101
3	13	103
select * from bp_cache_tmp1 where id in (1, 3, 5);
id	u	v
1	11	101
3	13	103
select * from bp_cache_tmp1 where u in (11, 13, 15);
id	u	v
1	11	101
3	13	103
select * from bp_cache_tmp1 where u in (11, 13) and u in (12, 13);
id	u	v
3	13	103
begin;
select * from bp_cache_tmp1 where id in (1, 3);
id	u	v
1	11	101
3	13	103
select * from bp_cache_tmp1 where u in (11, 13);
id	u	v
1	11	101
3	13	103
select * from bp_cache_tmp1 where id in (1, 3, 5);
id	u	v
1	11	101
3	13	103
select * from bp_cache_tmp1 where u in (11, 13, 15);
id	u	v
1	11	101
3	13	103
insert into bp_cache_tmp1 values(6, 16, 106);
select * from bp_cache_tmp1 where id in (1, 6);
id	u	v
1	11	101
6	16	106
select * from bp_cache_tmp1 where u in (11, 16);
id	u	v
1	11	101
6	16	106
update bp_cache_tmp1 set v=999 where id=3;
select * from bp_cache_tmp1 where id in (1, 3);
id	u	v
1	11	101
3	13	999
select * from bp_cache_tmp1 where u in (11, 13);
id	u	v
1	11	101
3	13	999
select * from bp_cache_tmp1 where u in (11, 13) and u in (12, 13);
id	u	v
3	13	999
delete from bp_cache_tmp1 where id=4;
select * from bp_cache_tmp1 where id in (1, 4);
id	u	v
1	11	101
select * from bp_cache_tmp1 where u in (11, 14);
id	u	v
1	11	101
commit;
select * from bp_cache_tmp1 where id in (1, 3, 6);
id	u	v
1	11	101
3	13	103
6	16	106
select * from bp_cache_tmp1 where u in (11, 13, 16);
id	u	v
1	11	101
3	13	103
6	16	106
select * from bp_cache_tmp1 where id in (1, 4);
id	u	v
1	11	101
select * from bp_cache_tmp1 where u in (11, 14);
id	u	v
1	11	101
alter table bp_cache_tmp1 nocache;
drop table bp_cache_tmp1;
drop table if exists cache_add_column;
create table cache_add_column (f1 int, index k(f1));
insert into cache_add_column (f1) values (1);
alter table cache_add_column add column f2 int not null, add column f3 int default 3, add column f4 int default null;
alter table cache_add_column cache;
select sleep(0.1);
sleep(0.1)
0
select * from cache_add_column;
f1	f2	f3	f4
1	0	3	NULL
select sleep(0.1);
sleep(0.1)
0
select * from cache_add_column;
f1	f2	f3	f4
1	0	3	NULL
select sleep(0.1);
sleep(0.1)
0
select * from cache_add_column;
f1	f2	f3	f4
1	0	3	NULL
select sleep(0.1);
sleep(0.1)
0
select * from cache_add_column;
f1	f2	f3	f4
1	0	3	NULL
select sleep(0.1);
sleep(0.1)
0
select * from cache_add_column;
f1	f2	f3	f4
1	0	3	NULL
select sleep(0.1);
sleep(0.1)
0
select * from cache_add_column;
f1	f2	f3	f4
1	0	3	NULL
select sleep(0.1);
sleep(0.1)
0
select * from cache_add_column;
f1	f2	f3	f4
1	0	3	NULL
select sleep(0.1);
sleep(0.1)
0
select * from cache_add_column;
f1	f2	f3	f4
1	0	3	NULL
select sleep(0.1);
sleep(0.1)
0
select * from cache_add_column;
f1	f2	f3	f4
1	0	3	NULL
select sleep(0.1);
sleep(0.1)
0
select * from cache_add_column;
f1	f2	f3	f4
1	0	3	NULL
select sleep(0.1);
sleep(0.1)
0
select * from cache_add_column use index(k) where f1 = 1;
f1	f2	f3	f4
1	0	3	NULL
select sleep(0.1);
sleep(0.1)
0
select * from cache_add_column use index(k) where f1 = 1;
f1	f2	f3	f4
1	0	3	NULL
select sleep(0.1);
sleep(0.1)
0
select * from cache_add_column use index(k) where f1 = 1;
f1	f2	f3	f4
1	0	3	NULL
select sleep(0.1);
sleep(0.1)
0
select * from cache_add_column use index(k) where f1 = 1;
f1	f2	f3	f4
1	0	3	NULL
select sleep(0.1);
sleep(0.1)
0
select * from cache_add_column use index(k) where f1 = 1;
f1	f2	f3	f4
1	0	3	NULL
select sleep(0.1);
sleep(0.1)
0
select * from cache_add_column use index(k) where f1 = 1;
f1	f2	f3	f4
1	0	3	NULL
select sleep(0.1);
sleep(0.1)
0
select * from cache_add_column use index(k) where f1 = 1;
f1	f2	f3	f4
1	0	3	NULL
select sleep(0.1);
sleep(0.1)
0
select * from cache_add_column use index(k) where f1 = 1;
f1	f2	f3	f4
1	0	3	NULL
select sleep(0.1);
sleep(0.1)
0
select * from cache_add_column use index(k) where f1 = 1;
f1	f2	f3	f4
1	0	3	NULL
select sleep(0.1);
sleep(0.1)
0
select * from cache_add_column use index(k) where f1 = 1;
f1	f2	f3	f4
1	0	3	NULL
alter table cache_add_column nocache;
drop table cache_add_column;
drop table if exists cache_explain;
create table cache_explain (id int primary key, u int unique, v int, key idx_v(v));
insert into cache_explain values(1, 11, 101), (2, 12, 102), (3, 13, 103);
alter table cache_explain cache;
explain select * from cache_explain where id = 1;
id	estRows	task	access object	operator info
Point_Get_1	1.00	root	table:cache_explain	handle:1
explain select * from cache_explain where id in (1, 2);
id	estRows	task	access object	operator info
Batch_Point_Get_1	2.00	root	table:cache_explain	handle:[1 2], keep order:false, desc:false
explain select * from cache_explain where u = 11;
id	estRows	task	access object	operator info
Point_Get_1	1.00	root	table:cache_explain, index:u(u)	
explain select * from cache_explain;
id	estRows	task	access object	operator info
TableReader_6	10000.00	root		data:TableFullScan_5
└─TableFullScan_5	10000.00	cop[tikv]	table:cache_explain	keep order:false, stats:pseudo
explain select * from cache_explain where id > 1;
id	estRows	task	access object	operator info
TableReader_7	3333.33	root		data:TableRangeScan_6
└─TableRangeScan_6	3333.33	cop[tikv]	table:cache_explain	range:(1,+inf], keep order:false, stats:pseudo
explain select * from cache_explain where v = 101;
id	estRows	task	access object	operator info
IndexLookUp_8	10.00	root		
├─IndexRangeScan_6(Build)	10.00	cop[tikv]	table:cache_explain, index:idx_v(v)	range:[101,101], keep order:false, stats:pseudo
└─TableRowIDScan_7(Probe)	10.00	cop[tikv]	table:cache_explain	keep order:false, stats:pseudo
alter table cache_explain nocache;
drop table cache_explain;
drop table if exists cache_range;
create table cache_range (id int primary key, v int);
insert into cache_range values(1, 10), (2, 20), (3, 30), (4, 40), (5, 50);
alter table cache_range cache;
select * from cache_range order by id;
id	v
1	10
2	20
3	30
4	40
5	50
select * from cache_range where id > 2 order by id;
id	v
3	30
4	40
5	50
select * from cache_range where id between 2 and 4 order by id;
id	v
2	20
3	30
4	40
alter table cache_range nocache;
drop table cache_range;
drop table if exists cache_limit;
create table cache_limit (id int primary key, v int);
insert into cache_limit values(1, 10), (2, 20), (3, 30), (4, 40), (5, 50);
alter table cache_limit cache;
select * from cache_limit order by id limit 3;
id	v
1	10
2	20
3	30
select * from cache_limit where id > 1 order by id limit 2;
id	v
2	20
3	30
explain select * from cache_limit order by id limit 3;
id	estRows	task	access object	operator info
Limit_12	3.00	root		offset:0, count:3
└─TableReader_22	3.00	root		data:Limit_21
  └─Limit_21	3.00	cop[tikv]		offset:0, count:3
    └─TableFullScan_20	102.97	cop[tikv]	table:cache_limit	keep order:true, stats:pseudo
alter table cache_limit nocache;
drop table cache_limit;
drop table if exists cache_idx;
create table cache_idx (id int primary key, a int, b int, key idx_a(a));
insert into cache_idx values(1, 10, 100), (2, 10, 200), (3, 20, 300), (4, 20, 400);
alter table cache_idx cache;
select * from cache_idx where a = 10 order by id;
id	a	b
1	10	100
2	10	200
select * from cache_idx where a = 20 order by id;
id	a	b
3	20	300
4	20	400
select * from cache_idx where a >= 10 and a <= 20 order by id;
id	a	b
1	10	100
2	10	200
3	20	300
4	20	400
alter table cache_idx nocache;
drop table cache_idx;
drop table if exists cache_life;
create table cache_life (id int primary key, v int);
insert into cache_life values(1, 100), (2, 200);
select * from cache_life where id = 1;
id	v
1	100
select * from cache_life where id = 2;
id	v
2	200
alter table cache_life cache;
select * from cache_life where id = 1;
id	v
1	100
select * from cache_life where id = 2;
id	v
2	200
alter table cache_life nocache;
select * from cache_life where id = 1;
id	v
1	100
select * from cache_life where id = 2;
id	v
2	200
alter table cache_life cache;
select * from cache_life where id = 1;
id	v
1	100
select * from cache_life where id = 2;
id	v
2	200
alter table cache_life nocache;
drop table cache_life;
